{
	"style": "new-york",
	"tailwind": {
		"css": "src/app.css",
		"baseColor": "zinc"
	},
	"aliases": {
		"components": "$lib/components",
		"utils": "$lib/utils",
		"ui": "$lib/components/ui",
		"hooks": "$lib/hooks",
		"lib": "$lib"
	},
	"typescript": true,
	"registry": "http://127.0.0.1:5186/registry"
}
